{
  "active_drivers": [],
  "authority": {
    "client_facing_authority": false,
    "decision_framework": "Legacy macro lane adjustments remain available for backward-compatible lane discovery only.",
    "decision_impact": "legacy_lane_adjustments_only",
    "input_state_contract": "Pricing audit and relative-strength artifacts remain production inputs; macro audit is metadata-only until promoted.",
    "operational_runbook": "Validate schema and compatibility before lane discovery; later phases may replace legacy regime logic after fixture/shadow review.",
    "output_contract": "Client-facing macro content remains governed by the existing runtime report path and must not expose shadow-only fields.",
    "shadow_only": true
  },
  "central_banks": {
    "boe": {
      "confidence": 0.45,
      "etf_implication": "No direct portfolio action unless UK exposure enters the universe.",
      "likely_direction": "Cautious easing bias",
      "main_risk": "Sticky services inflation keeps UK duration and cyclicals mixed.",
      "stance": "Neutral / transition"
    },
    "boj": {
      "confidence": 0.5,
      "etf_implication": "Avoid treating long-duration exposure as automatically defensive.",
      "likely_direction": "Slow tightening / balance-sheet normalization risk",
      "main_risk": "A yield or yen shock can tighten global financial conditions.",
      "stance": "Gradual normalization risk"
    },
    "ecb": {
      "confidence": 0.55,
      "etf_implication": "Non-U.S. developed exposure remains watchlist, not automatic add.",
      "likely_direction": "Gradual easing bias if inflation and growth allow",
      "main_risk": "Europe may not outperform without earnings breadth and currency support.",
      "stance": "Neutral / transition"
    },
    "fed": {
      "confidence": 0.65,
      "etf_implication": "Prefer quality, profitable growth and cash discipline over weak balance-sheet beta.",
      "likely_direction": "Hold-to-ease path, but timing remains data-dependent",
      "main_risk": "Real-rate repricing or delayed easing can pressure duration and speculative beta.",
      "stance": "Restrictive / data-dependent"
    },
    "pboc": {
      "confidence": 0.55,
      "etf_implication": "China exposure remains tactical watchlist unless price confirmation improves.",
      "likely_direction": "Targeted support rather than broad reflation unless confidence improves",
      "main_risk": "China stimulus disappointment can weigh on China beta and commodities.",
      "stance": "Supportive but credibility-sensitive"
    }
  },
  "confidence_decomposition": {
    "client_facing_authority": false,
    "components": {
      "GLD_return_3m_pct": -13.77,
      "IWM_rs_vs_SPY_3m_pct": 0.72,
      "SMH_return_3m_pct": 47.39,
      "SPY_return_3m_pct": 10.58,
      "TLT_return_3m_pct": 0.0,
      "legacy_confidence": 0.66
    },
    "decision_impact": "none_shadow_explanation_only",
    "method": "legacy_proxy_static_explained_for_schema_v1",
    "notes": [
      "This is a compatibility decomposition for the legacy proxy regime path.",
      "Deterministic derived confidence is planned for Phase 3 and is not yet production authority.",
      "Current legacy regime label: Risk-on growth"
    ],
    "shadow_only": true
  },
  "cross_asset_confirmation": [
    "Semiconductor leadership supports SMH, but SPY overlap must remain explicit.",
    "Small-cap and duration signals are not strong enough to justify broad beta expansion.",
    "Gold is treated as a hedge review item unless price behavior improves."
  ],
  "generated_at_utc": "2026-05-31T20:40:27.041155Z",
  "lane_adjustments": {
    "AI compute infrastructure": {
      "reason": "Regime and price leadership still support AI compute exposure, but concentration discipline applies.",
      "score_adjustment": 0.16
    },
    "China platform beta": {
      "reason": "Policy support is not yet enough to offset confidence and price-confirmation risk.",
      "score_adjustment": -0.08
    },
    "Defense innovation / sovereign resilience": {
      "reason": "Policy support is durable, but implementation quality remains the main decision bottleneck.",
      "score_adjustment": 0.08
    },
    "Gold hedge review": {
      "reason": "Gold must prove hedge behavior; macro status alone is not enough for fresh capital.",
      "score_adjustment": -0.06
    },
    "Grid buildout / electrification": {
      "reason": "AI power demand and infrastructure policy support the grid lane; funding still depends on PAVE-vs-GRID duel evidence.",
      "score_adjustment": 0.1
    },
    "Non-U.S. developed diversification": {
      "reason": "Diversification gap is real, but policy and relative-strength confirmation are not yet decisive.",
      "score_adjustment": 0.04
    },
    "Rate-sensitive small caps": {
      "reason": "Current regime does not yet confirm broad small-cap risk appetite.",
      "score_adjustment": -0.1
    }
  },
  "macro_data_audit_summary": {
    "client_facing_authority": false,
    "decision_impact": "none_phase2_audit_only",
    "mode": "none",
    "observation_count": 0,
    "present": false,
    "reference_date": null,
    "shadow_only": true,
    "status": "shadow_unavailable"
  },
  "macro_signals": {
    "duration": {
      "evidence": {
        "TLT_return_3m_pct": 0.0
      },
      "signal": "not_confirmed_as_tailwind"
    },
    "equity_leadership": {
      "evidence": {
        "IWM_rs_vs_SPY_3m_pct": 0.72,
        "SMH_return_3m_pct": 47.39,
        "SPY_return_3m_pct": 10.58
      },
      "signal": "mixed"
    },
    "hedge_ballast": {
      "evidence": {
        "GLD_return_3m_pct": -13.77
      },
      "signal": "under_review"
    }
  },
  "policy_catalysts": [
    {
      "affected_lanes": [
        "AI compute infrastructure",
        "Grid buildout / electrification"
      ],
      "confidence": 0.72,
      "direction": "supportive",
      "latest_signal": "Capital spending and strategic supply-chain policy continue to support semiconductor and infrastructure lanes.",
      "policy_area": "AI infrastructure and semiconductor supply chains",
      "time_horizon": "3-12 months",
      "transfer_to_report": true
    },
    {
      "affected_lanes": [
        "Defense innovation / sovereign resilience"
      ],
      "confidence": 0.65,
      "direction": "supportive but implementation-sensitive",
      "latest_signal": "Defense-budget durability remains a structural support, but ETF vehicle choice still matters.",
      "policy_area": "Defense and sovereign resilience",
      "time_horizon": "6-18 months",
      "transfer_to_report": true
    },
    {
      "affected_lanes": [
        "Uranium / nuclear fuel cycle"
      ],
      "confidence": 0.6,
      "direction": "supportive but cyclical",
      "latest_signal": "Energy-security policy keeps uranium and nuclear infrastructure relevant, but timing remains price-confirmation dependent.",
      "policy_area": "Energy security and nuclear policy",
      "time_horizon": "6-24 months",
      "transfer_to_report": false
    },
    {
      "affected_lanes": [
        "China platform beta",
        "EM equity beta"
      ],
      "confidence": 0.52,
      "direction": "mixed",
      "latest_signal": "Support remains watchlist-relevant, but confidence and earnings confirmation are still required.",
      "policy_area": "China stimulus and platform regulation",
      "time_horizon": "1-6 months",
      "transfer_to_report": false
    }
  ],
  "portfolio_implications": [
    "Risk appetite is supportive, but fresh adds still need position-size room and pricing confirmation.",
    "Growth and infrastructure lanes can be considered if they do not worsen concentration.",
    "Defensive hedges should be reviewed for opportunity cost."
  ],
  "regime": {
    "confidence": 0.66,
    "confidence_source": "legacy_proxy_static",
    "current": "Risk-on growth",
    "previous": "Unknown",
    "what_changed": [
      "AI / semiconductor leadership remains the dominant equity impulse.",
      "Gold hedge behavior remains under review rather than automatic ballast."
    ]
  },
  "regime_memory": {
    "breadth_trend": "mixed",
    "confidence_trend": "flat",
    "cross_asset_confirmation": "mixed",
    "current_confidence": 0.66,
    "current_regime": "Risk-on growth",
    "decision_rule": "Do not rotate aggressively unless a regime shift persists for at least two runs or cross-asset confirmation becomes broad.",
    "failed_rotation_count": 0,
    "last_major_shift": "2026-05-22",
    "previous_confidence": 0.66,
    "prior_regime": "Risk-on growth",
    "regime_changed_this_run": false,
    "report_date": "2026-05-29",
    "report_transfer": {
      "max_lines": 2,
      "show_in_report": true,
      "summary": "Risk-on growth has persisted for 39 run(s); transition state is stable, breadth is mixed, and cross-asset confirmation is mixed."
    },
    "transition_state": "stable",
    "updated_at_utc": "2026-05-31T20:40:27.041218Z",
    "weeks_in_regime": 39
  },
  "report_date": "2026-05-29",
  "report_transfer": {
    "max_policy_catalysts": 2,
    "max_portfolio_implications": 3,
    "max_what_changed_bullets": 3,
    "style_rule": "Transfer only decision-relevant macro information. Do not dump the full research pack into the report."
  },
  "schema_version": "1.0",
  "source_files": {
    "macro_context": "config/etf_macro_fundamental_context.yml",
    "macro_data_audit": null,
    "pricing_audit": "output/pricing/price_audit_2026-05-29_20260531_203900.json",
    "relative_strength": "output/market_history/etf_relative_strength.json"
  }
}